{
  "$schema":"https://json-schema.org/draft/2020-12/schema","$id":"https://warden-drydock.invalid/contracts/hosted/v1/provider.schema.json","title":"Provider readiness, consent, generation stream, and Draft v1","x-invariants":["provider_stream_order","provider_tool_binding"],
  "$defs":{"id":{"type":"string","minLength":3,"maxLength":80,"pattern":"^[a-z][a-z0-9]*(?:_[a-z0-9]+)*$"},"digest":{"type":"string","pattern":"^[a-f0-9]{64}$"},"event":{"oneOf":[{"type":"object","required":["sequence","event_type","call_id","tool","source_id","campaign_id","revision_id","source_set_digest"],"additionalProperties":false,"properties":{"sequence":{"type":"integer","minimum":1},"event_type":{"const":"tool_request"},"call_id":{"$ref":"#/$defs/id"},"tool":{"enum":["read_bound_source","read_bound_relationships","read_bound_history","emit_proposal_draft"]},"source_id":{"$ref":"#/$defs/id"},"campaign_id":{"$ref":"#/$defs/id"},"revision_id":{"$ref":"#/$defs/id"},"source_set_digest":{"$ref":"#/$defs/digest"}}},{"type":"object","required":["sequence","event_type"],"additionalProperties":false,"properties":{"sequence":{"type":"integer","minimum":1},"event_type":{"enum":["start","delta","tool_result","usage","completion","cancel","failure"]},"draft_fragment":{"type":"string","maxLength":4000},"call_id":{"$ref":"#/$defs/id"},"retryable":{"type":"boolean"}}}]}},
  "type":"object","required":["contract_name","contract_version","provider","readiness","consent_identity","generation_id","campaign_id","revision_id","source_set_digest","events","terminal_draft","resume"],"additionalProperties":false,
  "properties":{"contract_name":{"const":"provider_generation"},"contract_version":{"const":1},"provider":{"type":"object","required":["adapter_id","adapter_version","secret_present","credential_revision_fingerprint","verification_state","endpoint_id","region","storage_mode"],"additionalProperties":false,"properties":{"adapter_id":{"$ref":"#/$defs/id"},"adapter_version":{"type":"string","pattern":"^[0-9]+\\.[0-9]+\\.[0-9]+$"},"secret_present":{"type":"boolean"},"credential_revision_fingerprint":{"$ref":"#/$defs/digest"},"verification_state":{"enum":["unverified","verified","failed"]},"endpoint_id":{"$ref":"#/$defs/id"},"region":{"$ref":"#/$defs/id"},"storage_mode":{"enum":["provider_default","no_training"]}}},"readiness":{"enum":["setup_required","consent_required","ready","provider_degraded"]},"consent_identity":{"type":"object","required":["credential_revision_fingerprint","adapter_version","endpoint_id","region","storage_mode","retrieval_policy_version","notice_digest","current"],"additionalProperties":false,"properties":{"credential_revision_fingerprint":{"$ref":"#/$defs/digest"},"adapter_version":{"type":"string","pattern":"^[0-9]+\\.[0-9]+\\.[0-9]+$"},"endpoint_id":{"$ref":"#/$defs/id"},"region":{"$ref":"#/$defs/id"},"storage_mode":{"enum":["provider_default","no_training"]},"retrieval_policy_version":{"type":"integer","minimum":1},"notice_digest":{"$ref":"#/$defs/digest"},"current":{"type":"boolean"}}},"generation_id":{"$ref":"#/$defs/id"},"campaign_id":{"$ref":"#/$defs/id"},"revision_id":{"$ref":"#/$defs/id"},"source_set_digest":{"$ref":"#/$defs/digest"},"events":{"type":"array","minItems":1,"uniqueItems":true,"items":{"$ref":"#/$defs/event"}},"usage":{"type":"object","required":["input_units","output_units"],"additionalProperties":false,"properties":{"input_units":{"type":"integer","minimum":0},"output_units":{"type":"integer","minimum":0}}},"terminal_draft":{"type":"object","required":["draft_id","authority","status","content_digest"],"additionalProperties":false,"properties":{"draft_id":{"$ref":"#/$defs/id"},"authority":{"const":"draft"},"status":{"enum":["complete","failed","cancelled"]},"content_digest":{"$ref":"#/$defs/digest"}}},"resume":{"type":"object","required":["after_sequence","terminal_available"],"additionalProperties":false,"properties":{"after_sequence":{"type":"integer","minimum":0},"terminal_available":{"type":"boolean"}}}}
}
