{"contract_name":"provider_generation","contract_version":1,"provider":{"adapter_id":"provider_alpha","adapter_version":"1.0.0","secret_present":true,"credential_revision_fingerprint":"aaaaaaaaaaaaaaaaaaaaaaaaaaaaaaaaaaaaaaaaaaaaaaaaaaaaaaaaaaaaaaaa","verification_state":"verified","endpoint_id":"endpoint_primary","region":"region_local","storage_mode":"no_training"},"readiness":"ready","consent_identity":{"credential_revision_fingerprint":"aaaaaaaaaaaaaaaaaaaaaaaaaaaaaaaaaaaaaaaaaaaaaaaaaaaaaaaaaaaaaaaa","adapter_version":"1.0.0","endpoint_id":"endpoint_primary","region":"region_local","storage_mode":"no_training","retrieval_policy_version":1,"notice_digest":"bbbbbbbbbbbbbbbbbbbbbbbbbbbbbbbbbbbbbbbbbbbbbbbbbbbbbbbbbbbbbbbb","current":true},"generation_id":"generation_alpha","campaign_id":"campaign_alpha","revision_id":"revision_12","source_set_digest":"cccccccccccccccccccccccccccccccccccccccccccccccccccccccccccccccc","events":[{"sequence":1,"event_type":"start"},{"sequence":2,"event_type":"completion"}],"usage":{"input_units":10,"output_units":5},"terminal_draft":{"draft_id":"draft_alpha","authority":"draft","status":"complete","content_digest":"dddddddddddddddddddddddddddddddddddddddddddddddddddddddddddddddd"},"resume":{"after_sequence":0,"terminal_available":true}}
